resource	resource_meta
Protection from enslavement	Protection from enslavement
Protection from enslavement after conquest	Protection from enslavement
Protection from enslavement for debt	Protection from enslavement
Protection from enslavement for non-payment	Protection from enslavement
Protection from enslavement in war	Protection from enslavement
Protection from envy and superstition	Protection from public libel
Protection from excessive hostage-taking	Right to freedom of movement
Protection from execution	Protection from capital punishment
Protection from execution without trial	Protection from capital punishment
Protection from expulsion	Protection from arbitrary banishment
Protection from extended physical restraint	Protection from corporal punishment
Protection from extra-judicial killing	Protection from capital punishment
Protection from extra-territorial seizure	Protection from enslavement
Protection from failed prosecution costs	Protection from legal prosecution
Protection from financial penalties	Exemption from taxes
Protection from fines	Exemption from taxes
Protection from fines for non-attendance	Exemption from taxes
Protection from forced intoxication	Protection from corporal punishment
Protection from forced labor	Exemption from manual labor
Protection from frontline combat risks	Exemption from compulsory public financing
Protection from gender-specific labels of untidiness	Protection from public libel
Protection from gymnastics fines	Exemption from taxes
Protection from hard labor	Exemption from manual labor
Protection from harsh commands	Protection from corporal punishment
Protection from harsh sentencing	Right to a legal trial
Protection from hazardous military command	Exemption from compulsory public financing
Protection from homicide prosecution	Protection from legal prosecution
Protection from imprisonment	Protection from corporal punishment
Protection from imprisonment without trial	Right to a legal trial
Protection from individual liability	Protection from legal prosecution
Protection from individualized legislation	Protection from legal prosecution
Protection from judicial torture	Protection from corporal punishment
Protection from jury service fines	Exemption from taxes
Protection from legal action by debtors	Protection from legal prosecution
Protection from legal actions	Protection from legal prosecution
Protection from legal challenge	Protection from legal prosecution
Protection from legal consequences of cowardice	Protection from legal prosecution
Protection from legal inquiry into income	Exemption from legal audit
Protection from legal liability	Protection from legal prosecution
Protection from legal or social censure	Protection from public libel
Protection from legal penalties	Protection from legal prosecution
Protection from legal proceedings	Protection from legal prosecution
Protection from legal prosecution	Protection from legal prosecution
Protection from legal prosecution for beliefs	Protection from legal prosecution
Protection from legal prosecution for neglect	Protection from legal prosecution
Protection from legal punishment	Protection from legal prosecution
Protection from magisterial intervention	Protection from legal prosecution
Protection from marital jealousy	Protection from marital jealousy
Protection from menial labor	Exemption from manual labor
Protection from naval financing burdens	Exemption from compulsory public financing
Protection from oppression	Protection from legal prosecution
Protection from oral reproach during courtship	Protection from public libel
Protection from ostracism	Protection from arbitrary banishment
Protection from physical harm	Protection from corporal punishment
Protection from physical insult	Protection from corporal punishment
Protection from physical mutilation	Protection from corporal punishment
Protection from physical outrage	Protection from corporal punishment
Protection from physical torture during legal inquiry	Protection from corporal punishment
Protection from political envy	Protection from public libel
Protection from political exclusion	Right to citizenship
Protection from pretrial detention	Right to a legal trial
Protection from pretrial imprisonment through sureties	Right to a legal trial
Protection from private detention	Protection from enslavement
Protection from private ownership claims	Right to own property
Protection from property confiscation	Right to retain property
Protection from property damage	Right to retain property
Protection from property injustice	Right to retain property
Protection from prosecution for past events	Protection from legal prosecution
Protection from prosecution for past political acts	Protection from legal prosecution
Protection from providing unverified testimony	Right to valid professional opinion
Protection from public censure	Protection from public libel
Protection from public debt registration	Right to retain property
Protection from public degradation	Protection from public libel
Protection from public disgrace	Protection from public libel
Protection from public libel	Protection from public libel
Protection from public ridicule	Protection from public libel
Protection from pursuit by popular lovers	Right to bodily autonomy
Protection from re-trial on same charges	Right to a legal trial
Protection from ritual pollution of blood	Access to religious rites
Protection from severe financial penalties	Right to retain property
Protection from severe physical exertion	Exemption from manual labor
Protection from sexual assault	Right to bodily autonomy
Protection from sexual exploitation	Right to bodily autonomy
Protection from sexual violation	Right to bodily autonomy
Protection from slander	Protection from public libel
Protection from slanderers and parasites	Protection from public libel
Protection from social stigma	Protection from public libel
Protection from standard funerary rites	Right to burial
Protection from state-sanctioned wrongdoing	Right to a legal trial
Protection from summary execution	Protection from capital punishment
Protection from summary punishment	Protection from corporal punishment
Protection from summary punishment by the dictator	Protection from corporal punishment
Protection from temporary banishment	Protection from arbitrary banishment
Protection from ten-year exile	Protection from arbitrary banishment
Protection from the necessity of supplication	Protection from legal prosecution
Protection from torture during legal proceedings	Protection from corporal punishment
Protection from treatment as prisoners of war	Protection from enslavement
Protection from unlawful killing	Protection from capital punishment
Protection from verbal abuse	Protection from public libel
Protection from verbal harassment	Protection from public libel
Protection from vocal exertion	Exemption from manual labor
Protection from vulgar representation	Protection from public libel
Protection from young leaders	Political power
Protection of cognitive function	Right to bodily autonomy
Protection of domestic integrity	Right to retain property
Protection of person from seizure for debt	Protection from enslavement
Protection of physical integrity	Right to bodily autonomy
Protection of posthumous honors	Access to public honors
Protection of property	Right to own property
Protection of property and person	Right to citizenship
Protection of property integrity	Right to retain property
Protection of rights	Right to citizenship
Protection under state rule	Political power
Protection via public covenants and oaths	Right to a legal trial
Protection via sworn jury judgment	Right to a legal trial
Public financing for military forces	Right to bear arms
Public funeral rites	Right to burial
Public honor and social status	Access to public honors
Public maintenance and armor	Right to bear arms
Public manumission in the theater	Protection from enslavement
Public payment for assembly attendance	Right to remuneration for office
Public signs of respect from magistrates	Access to public honors
Public upbringing and honor	Access to public honors
Recognition as a distinct species	Right to citizenship
Recognition of moral worth	Access to public honors
Recognition of superior wisdom	Right to valid professional opinion
Religious education	Access to religious rites
Remission of sins through baptism	Right to inherit divine covenant
Remuneration for public office	Right to remuneration for office
Requirement of professional training	Access to public honors
Reserved seating at festivals	Access to public honors
Respect from subordinates	Access to public honors
Retention of civic rights	Right to citizenship
Retention of civil rights	Right to citizenship
Right of access to the free agora	Right to freedom of movement
Right of access to the sanctuary	Access to religious rites
Right of appeal to higher authority	Right to a legal trial
Right of appeal to jury-courts	Right to a legal trial
Right of entry to private gatherings	Right to freedom of movement
Right of entry to the temple	Access to religious rites
Right of free association	Political power
Right of free speech	Right to free speech
Right of residence	Right to reside in the city
Right of residence in Attica	Right to reside in the city
Right of residence in the city	Right to reside in the city
Right of return after reconciliation	Protection from arbitrary banishment
Right of speech in assembly	Right to address the assembly
Right of unannounced royal audience	Access to public honors
Right of voluntary exile during trial	Protection from capital punishment
Right to Athenian citizenship	Right to citizenship
Right to Roman citizenship	Right to citizenship
Right to a ceremonial lictor escort	Access to public honors
Right to a dowry	Right to a dowry
Right to a fixed name	Access to public honors
Right to a legal defense	Right to a legal trial
Right to a legal trial	Right to a legal trial
Right to a marriage dowry	Right to a dowry
Right to a public funeral	Right to burial
Right to a public funeral oration	Right to burial
Right to a public funeral procession	Right to burial
Right to a public trial before execution	Right to a legal trial
Right to a share of the estate	Right to inherit property
Right to a trial at law	Right to a legal trial
Right to absolute sovereignty	Political power
Right to accountable government	Political power
Right to acquire affluence	Right to retain own earnings
Right to acquire land	Right to own land
Right to act as a juryman	Eligibility for public office
Right to act as prosecutor	Right to a legal trial
Right to address the Assembly	Right to address the assembly
Right to address the assembly	Right to address the assembly
Right to address the divine	Access to religious rites
Right to address the popular assembly	Right to address the assembly
Right to adjudicate in courts	Eligibility for public office
Right to adjudicate legal rights	Eligibility for public office
Right to adopt a son	Right to adopt
Right to alienate property	Right to dispose of property
Right to alter standard language	Right to valid professional opinion
Right to alter treatment protocols	Right to professional judgement
Right to an equal land allotment	Right to own land
Right to an impartial hearing	Right to a legal trial
Right to ancestral land	Right to own land
Right to annual holiday	Exemption from manual labor
Right to appeal to the court	Right to a legal trial
Right to appoint Law-wardens	Political power
Right to appoint ambassadors	Political power
Right to appoint heirs	Right to dispose of property
Right to assemble for collective judgment	Political power
Right to associate freely	Right to freedom of movement
Right to assume royal power	Eligibility for public office
Right to athletic training	Access to the gymnasium
Right to attend Olympic games	Access to religious rites
Right to attend council meetings	Political power
Right to attend popular assembly	Right to vote in the Ekklesia
Right to attend public banquets	Access to public honors
Right to attend public festivals	Access to religious rites
Right to attend public meals	Access to public honors
Right to attend public sacrifices	Access to religious rites
Right to attend the Thesmophoria	Access to religious rites
Right to attend the assembly	Right to vote in the Ekklesia
Right to attend to private business	Right to retain own earnings
Right to attendance fee	Right to remuneration for office
Right to audit magistrates	Political power
Right to autonomous legal status	Right to citizenship
Right to autonomous sexual choice	Right to bodily autonomy
Right to banquet entertainment	Access to public honors
Right to be called a grammarian	Access to public honors
Right to be entertained as guest	Access to public honors
Right to be manumitted by peers	Protection from enslavement
Right to be part of the community	Right to citizenship
Right to be portrayed as manly or clever	Access to public honors
Right to be ransomed from captivity	Protection from enslavement
Right to be reared	Protection from capital punishment
Right to be reared by kin	Protection from capital punishment
Right to be recognized as a grammarian	Access to public honors
Right to be recognized as inventors	Access to public honors
Right to be recorded as a citizen	Right to citizenship
Right to be regarded as holy	Access to religious rites
Right to be released without ransom	Protection from enslavement
Right to be returned if defective	Right to retain property
Right to bear ancestral names	Right to citizenship
Right to bear arms	Right to bear arms
Right to bear arms in public	Right to bear arms
Right to bear legitimate heirs	Right to inherit property
Right to bequeath property	Right to dispose of property
Right to bestow public commendation	Access to public honors
Right to block illegal proposals	Political power
Right to bodily autonomy	Right to bodily autonomy
Right to bring a private suit for battery	Right to a legal trial
Right to bring bills to the senate	Political power
Right to bring legal suit	Right to a legal trial
Right to bring private suits	Right to a legal trial
Right to bring public indictments	Right to a legal trial
Right to burial	Right to burial
Right to burial in native city	Right to burial
Right to burial within city walls	Right to burial
Right to buy corn in bulk	Right to retain own earnings
Right to carry ceremonial weaponry	Right to bear arms
Right to change masters	Right to bodily autonomy
Right to change occupations	Right to freedom of movement
Right to charge a fee	Right to retain own earnings
Right to choose a spouse	Right to bodily autonomy
Right to choose funerary rites	Right to burial
Right to choose intellectual or life path	Right to freedom of movement
Right to choose marriage partner	Right to bodily autonomy
Right to choose narrative metre	Right to free speech
Right to choose non-Corinthian generals	Political power
Right to choose public orators	Political power
Right to choose spouse	Right to bodily autonomy
Right to citizenship	Right to citizenship
Right to civic participation	Right to citizenship
Right to civic rights	Right to citizenship
Right to civil disobedience	Right to free speech
Right to claim the divine covenant	Right to inherit divine covenant
Right to collect fees	Right to retain own earnings
Right to command workmen	Political power
Right to common land produce	Right to own land
Right to communal property	Right to own property
Right to communicate through gesture	Right to free speech
Right to compete in public festivals	Access to religious rites
Right to conduct business independently	Right to retain own earnings
Right to conduct divine worship	Access to religious rites
Right to conduct primary sacrifice	Access to religious rites
Right to conduct trade	Right to retain own earnings
Right to consort with the god Hades	Access to religious rites
Right to consume alcohol	Right to drink wine
Right to consume excess alcohol	Right to drink wine
Right to consume sacrificial offerings	Access to religious rites
Right to continued participation in discourse	Right to address the assembly
Right to continuous military command	Eligibility for public office
Right to contracted pay	Right to retain own earnings
Right to control animal breeding	Right to own property
Right to control inherited property	Right to inherit property
Right to control pledged cargo	Right to own property
Right to control possessions	Right to retain property
Right to control temples	Access to religious rites
Right to customary burial	Right to burial
Right to decide on war	Political power
Right to decline public office	Exemption from public service financing
Right to dedicate gifts	Access to religious rites
Right to defend legal institutions	Political power
Right to defer to established authority	Political power
Right to define communal justice	Political power
Right to define honorable conduct	Access to public honors
Right to deliberate in council	Political power
Right to deliberate on war	Political power
Right to deliberative authority	Political power
Right to democratic government	Political power
Right to deviate from technical accuracy	Right to valid professional opinion
Right to dine in public quarters	Access to public honors
Right to direct property management	Right to own property
Right to dispose of property	Right to dispose of property
Right to dispose of property by will	Right to dispose of property
Right to distribute extra food	Right to dispose of property
Right to distribute private wealth as public charity	Right to dispose of property
Right to divine hearing	Access to religious rites
Right to drink wine	Right to drink wine
Right to eat doves	Right to drink wine
Right to eat fish	Right to drink wine
Right to eat pork	Right to drink wine
Right to elect ambassadors	Right to vote in the Ekklesia
Right to elect magistrates	Right to vote in the Ekklesia
Right to elect officials	Right to vote in the Ekklesia
Right to enforce private contracts	Right to a legal trial
Right to enforce voluntary contracts	Right to a legal trial
Right to engage in business	Right to retain own earnings
Right to engage in lawful war against tyrants	Political power
Right to engage in piracy	Right to retain own earnings
Right to engage in sex work	Right to retain own earnings
Right to enjoy liberty and equality	Right to citizenship
Right to enter sacred or public places	Access to religious rites
Right to enter the market-place and wear garlands	Access to religious rites
Right to enter the temple	Access to religious rites
Right to equal legal application	Right to a legal trial
Right to equal political power	Political power
Right to equal share in the state	Right to citizenship
Right to equal share of estate	Right to inherit property
Right to equal suffrage	Right to vote in the Ekklesia
Right to equal tax rates	Exemption from taxes
Right to establish language	Right to valid professional opinion
Right to establish names	Right to valid professional opinion
Right to exclusive marriage	Right to citizenship
Right to exclusive marriage and paternity	Right to citizenship
Right to exclusive professional judgment	Right to professional judgement
Right to execute valid wills	Right to dispose of property
Right to exercise authority over free children	Right to adopt
Right to exercise citizenship	Right to citizenship
Right to exercise civic rights	Right to citizenship
Right to exercise craft with imperfect tools	Right to valid professional opinion
Right to exercise deliberative and judicial functions	Political power
Right to exercise harsh judgment	Right to professional judgement
Right to exercise judicial punishment	Political power
Right to exercise lethal vengeance	Political power
Right to exercise official authority over parents	Eligibility for public office
Right to exercise physical restraint	Political power
Right to exercise sovereignty	Political power
Right to exercise summary execution	Political power
Right to exercise the franchise	Right to vote in the Ekklesia
Right to exert wide-reaching rule	Political power
Right to exile or execute citizens	Political power
Right to export raw materials	Right to dispose of property
Right to external military alliance	Political power
Right to feast in the Prytaneum	Access to public honors
Right to file a legal claim for an estate	Right to inherit property
Right to financial compensation for public service	Right to remuneration for office
Right to financial maintenance	Right to a dowry
Right to food	Access to public honors
Right to form marriage alliances	Right to citizenship
Right to forsake oaths without divine penalty	Exemption from legal audit
Right to free public meals	Access to public honors
Right to free speech	Right to free speech
Right to free trade	Right to own property
Right to freedom	Protection from enslavement
Right to freedom by birth	Protection from enslavement
Right to full personal rights	Right to citizenship
Right to funeral from home	Right to burial
Right to give voluntary legal testimony	Right to valid professional opinion
Right to govern others	Political power
Right to govern the city	Political power
Right to grant legal pardon	Political power
Right to grant life to criminals	Political power
Right to guard the perpetual fire	Access to religious rites
Right to have legal acts recognized	Right to citizenship
Right to have supporting speakers (synegoroi)	Right to a legal trial
Right to hear sacred mysteries	Access to religious rites
Right to hold citizenship	Right to citizenship
Right to hold common meals and study-circles	Access to religious rites
Right to hold ecclesiastical office	Eligibility for public office
Right to hold gold and silver	Right to own property
Right to hold hereditary office	Eligibility for public office
Right to hold inventory	Right to own property
Right to hold multiple terms	Eligibility for public office
Right to hold office	Eligibility for public office
Right to hold political office	Eligibility for public office
Right to hold property and reside in Athens	Right to reside in the city
Right to hold public honors	Access to public honors
Right to hold public office	Eligibility for public office
Right to hold religious festivals	Access to religious rites
Right to hold repeat office	Eligibility for public office
Right to hold sovereign power	Political power
Right to hold speakers to promises	Right to a legal trial
Right to hold the kingship	Eligibility for public office
Right to home delivery of resources	Right to retain own earnings
Right to hospitable reception	Right to citizenship
Right to hunt or touch doves	Access to religious rites
Right to immediate gratification of desire	Right to bodily autonomy
Right to impartial legal hearing	Right to a legal trial
Right to impeach public officials	Political power
Right to imprecise speech	Right to free speech
Right to independent action	Right to bodily autonomy
Right to independent legal action	Right to a legal trial
Right to indict for impiety	Right to a legal trial
Right to indict on own behalf	Right to a legal trial
Right to inflict capital punishment independently	Political power
Right to inhabit common locality	Right to reside in the city
Right to inherit as heiress	Right to inherit property
Right to inherit property	Right to inherit property
Right to inherit property directly	Right to inherit property
Right to inherit property through marriage	Right to inherit property
Right to inherit the divine covenant	Right to inherit divine covenant
Right to initiate divorce	Right to bodily autonomy
Right to initiation in mysteries	Access to religious rites
Right to integrate with male guests	Right to citizenship
Right to intellectual judgment	Right to valid professional opinion
Right to intended marriage	Right to bodily autonomy
Right to intercede in legal proceedings	Right to a legal trial
Right to interpret poetic thought	Right to professional judgement
Right to introduce legal amendments	Political power
Right to introduce new divinities	Access to religious rites
Right to issue binding awards	Political power
Right to judge lawsuits	Eligibility for public office
Right to judge professional discourse	Right to professional judgement
Right to judge wholesome food	Right to valid professional opinion
Right to judge without eyewitness knowledge	Eligibility for public office
Right to judicial impartiality	Right to a legal trial
Right to keep hair before marriage	Right to bodily autonomy
Right to lead religious construction	Access to religious rites
Right to lead royal expeditions	Eligibility for public office
Right to lease industrial equipment	Right to own property
Right to leave the country	Right to freedom of movement
Right to legal adjudication	Right to a legal trial
Right to legal advocacy	Right to a legal trial
Right to legal clemency	Protection from capital punishment
Right to legal equity	Right to a legal trial
Right to legal independence	Right to citizenship
Right to legal personhood	Right to citizenship
Right to legal redress	Right to a legal trial
Right to legal standing for others	Right to a legal trial
Right to legal/social rescue	Protection from enslavement
Right to legislative assembly	Political power
Right to legitimate royal succession	Eligibility for public office
Right to leisure	Exemption from manual labor
Right to life	Protection from capital punishment
Right to life and residence	Right to reside in the city
Right to life during magistracy bids	Protection from capital punishment
Right to live with license	Right to bodily autonomy
Right to local adjudication	Right to a legal trial
Right to local self-government	Political power
Right to local trial in Athens	Right to a legal trial
Right to maintain official financial records	Eligibility for public office
Right to maintain private fish preserves	Right to own property
Right to make a will without a guardian	Right to dispose of property
Right to manage household property	Right to own property
Right to manage household stores	Right to own property
Right to manage property independently	Right to own property
