resource	resource_meta
Ability to participate effectively in courts	Right to a legal trial
Ability to satisfy desires	Right to bodily autonomy
Access to Assembly proceedings	Right to address the assembly
Access to a life of citizenship	Right to citizenship
Access to advanced dialectical training	Access to the gymnasium
Access to advanced rhythmic study	Access to the gymnasium
Access to agricultural capital	Right to own property
Access to arbitration for civil disputes	Right to a legal trial
Access to citizen marriage	Right to citizenship
Access to common food funds	Right to remuneration for office
Access to common meals	Access to public honors
Access to communal drinking cups	Access to religious rites
Access to concise physical doctrines	Right to valid professional opinion
Access to customary religious expiation	Access to religious rites
Access to deceased foreigners' bank records	Right to inherit property
Access to detailed natural science	Right to valid professional opinion
Access to divine communication	Access to religious rites
Access to divine grace	Access to religious rites
Access to education	Access to the gymnasium
Access to educational mentorship	Access to public honors
Access to elite social dining	Access to public honors
Access to ethical education	Access to the gymnasium
Access to exact knowledge	Right to professional judgement
Access to formal academic instruction	Access to the gymnasium
Access to friends' private possessions	Right to own property
Access to gymnastic exercises	Access to the gymnasium
Access to high-level imperial governance	Political power
Access to high-quality plot structures	Access to public honors
Access to honest admonition	Right to free speech
Access to intellectual appreciation	Access to public honors
Access to intellectual banquets	Access to public honors
Access to internal Pythagorean discussions	Political power
Access to justice	Right to a legal trial
Access to knowledge of virtue	Right to valid professional opinion
Access to legal education	Access to the gymnasium
Access to leisure	Exemption from manual labor
Access to liberal education	Access to the gymnasium
Access to local judicial proceedings	Right to a legal trial
Access to luxury foods	Right to drink wine
Access to magistracies	Eligibility for public office
Access to mental recreation	Access to the gymnasium
Access to military education	Access to the gymnasium
Access to multiple paid tribunals	Right to remuneration for office
Access to music and noble pastimes	Access to the gymnasium
Access to musical education	Access to the gymnasium
Access to non-practical books and treatises	Access to the gymnasium
Access to non-standard diction	Right to free speech
Access to philosophical discourse	Access to the gymnasium
Access to philosophical education	Access to the gymnasium
Access to philosophical teachings	Access to the gymnasium
Access to physical training	Access to the gymnasium
Access to pleasure	Access to the gymnasium
Access to pleasures of knowledge	Access to the gymnasium
Access to political honors	Access to public honors
Access to political influence	Political power
Access to private specialized education	Access to the gymnasium
Access to professional certification	Right to valid professional opinion
Access to professional legitimacy	Right to professional judgement
Access to public amenities for free	Exemption from taxes
Access to public entertainment	Access to religious rites
Access to public fees	Right to remuneration for office
Access to public festival funds	Access to public honors
Access to public financial distributions	Access to public honors
Access to public funds	Access to public honors
Access to public honors	Access to public honors
Access to public maintenance	Access to public honors
Access to public meals	Access to public honors
Access to public moral education	Access to the gymnasium
Access to public sacrifices	Access to religious rites
Access to public spectacles	Access to religious rites
Access to public subsidies	Access to public honors
Access to purification rituals	Access to religious rites
Access to religious education	Access to religious rites
Access to religious festivals	Access to religious rites
Access to religious knowledge	Access to religious rites
Access to religious sanctuaries	Access to religious rites
Access to religious secrets	Access to religious rites
Access to residential spaces	Right to reside in the city
Access to sacred buildings and juries	Access to religious rites
Access to sacred groves	Access to religious rites
Access to sacred mysteries	Access to religious rites
Access to sacred rites	Access to religious rites
Access to sacred spaces	Access to religious rites
Access to shared social spaces	Right to reside in the city
Access to social acceptance	Access to public honors
Access to special commercial courts (dikai emporikai)	Right to a legal trial
Access to specialized instruction	Access to specialized instruction
Access to specialized maritime courts	Right to a legal trial
Access to specialized military education	Access to the gymnasium
Access to specialized public entertainment	Access to religious rites
Access to specific judicial venues	Right to a legal trial
Access to specific public spaces	Right to reside in the city
Access to state-funded distributions	Access to public honors
Access to state-funded maintenance	Access to public honors
Access to statesmanship science	Eligibility for public office
Access to suitable musical modes	Access to specialized instruction
Access to temple revenues	Access to religious rites
Access to temples and religious services	Access to religious rites
Access to the Agora	Right to reside in the city
Access to the Agora during murder trials	Right to reside in the city
Access to the Thesmophoria	Access to religious rites
Access to the Thesmophoria festival	Access to religious rites
Access to the council of elders	Eligibility for public office
Access to the gymnasium	Access to the gymnasium
Access to the gymnasium and physical training	Access to the gymnasium
Access to the inner sanctuary	Access to religious rites
Access to the music school	Access to the gymnasium
Access to the orchestra	Access to religious rites
Access to the prytaneum	Access to public honors
Access to the ruler's table and companionship	Access to public honors
Access to the temple	Access to religious rites
Access to the temple interior	Access to religious rites
Access to the vision of absolute beauty	Access to religious rites
Access to the water-supply	Right to reside in the city
Access to theatrical education	Access to the gymnasium
Access to theological and astronomical education	Access to specialized instruction
Access to time for teaching	Right to valid professional opinion
Access to true happiness	Access to public honors
Access to true mental images	Access to religious rites
Access to virtue	Access to public honors
Accountability of public officials	Exemption from legal audit
Administrative control over city infrastructure	Political power
Administrative protection of estate and person	Protection from legal prosecution
Annual eligibility for the generalship	Eligibility for public office
Assigned seating in theater front ranks	Access to public honors
Association with the goddess Artemis	Access to religious rites
Authority based on compulsion	Political power
Authority over free children	Political power
Authority over spectacular effects	Right to valid professional opinion
Authority to establish names	Right to valid professional opinion
Authority to issue own commands	Political power
Authority to judge technical accuracy	Right to professional judgement
Autonomy in local government	Political power
Autonomy in moral conduct	Right to bodily autonomy
Autonomy in political persuasion	Right to free speech
Bodily integrity	Right to bodily autonomy
Capacity for abstract reasoning	Right to professional judgement
Capacity for convincing representation	Right to valid professional opinion
Capacity to form valid personal opinion	Right to valid professional opinion
Capacity to procreate	Right to bodily autonomy
Citizenship	Right to citizenship
Common benefits of the state	Right to citizenship
Communal access to wives	Right to bodily autonomy
Communal dining (Syssitia)	Access to public honors
Compulsory public service	Exemption from compulsory public financing
Daily subsistence allowance	Right to remuneration for office
Divine favor	Right to inherit divine covenant
Education according to rational development	Access to the gymnasium
Eligibility for adoption	Right to adopt
Eligibility for advantageous marriage alliances	Right to a dowry
Eligibility for archonship and priesthoods	Eligibility for public office
Eligibility for choregia	Exemption from compulsory public financing
Eligibility for citizenship	Right to citizenship
Eligibility for crowning	Access to public honors
Eligibility for diplomatic office	Eligibility for public office
Eligibility for dual Athenian parentage	Right to citizenship
Eligibility for governance of boys	Eligibility for public office
Eligibility for high court judgeship	Eligibility for public office
Eligibility for high office	Eligibility for public office
Eligibility for high public status	Access to public honors
Eligibility for honorary crown	Access to public honors
Eligibility for honorary reward	Access to public honors
Eligibility for jury service	Eligibility for public office
Eligibility for kingship	Eligibility for public office
Eligibility for kingship and generalship	Eligibility for public office
Eligibility for magistracies	Eligibility for public office
Eligibility for office	Eligibility for public office
Eligibility for olive crowns	Access to public honors
Eligibility for political appointments	Eligibility for public office
Eligibility for political consultancy	Eligibility for public office
Eligibility for political leadership	Eligibility for public office
Eligibility for priestly attendance	Eligibility for public office
Eligibility for priestly office (Basilissa)	Eligibility for public office
Eligibility for public athletic honors	Access to public honors
Eligibility for public competitions	Access to public honors
Eligibility for public financial rewards	Access to public honors
Eligibility for public honors	Access to public honors
Eligibility for public honors during audit	Access to public honors
Eligibility for public office	Eligibility for public office
Eligibility for royal honors	Access to public honors
Eligibility for supreme leadership	Eligibility for public office
Eligibility for the Committee of Public Safety	Eligibility for public office
Eligibility for the Council	Eligibility for public office
Eligibility for the Senate	Eligibility for public office
Eligibility for the admiralship	Eligibility for public office
Eligibility for the archonship	Eligibility for public office
Eligibility for the archonship and public offices	Eligibility for public office
Eligibility for the cavalry	Eligibility for public office
Eligibility for the chief magistracy	Eligibility for public office
Eligibility for the consulship	Eligibility for public office
Eligibility for the deliberative body	Eligibility for public office
Eligibility for the ephorate	Eligibility for public office
Eligibility for the generalship	Eligibility for public office
Eligibility for the gymnasiarchy	Eligibility for public office
Eligibility for the highest offices	Eligibility for public office
Eligibility for the judiciary	Eligibility for public office
Eligibility for the kingship	Eligibility for public office
Eligibility for the law-making council	Eligibility for public office
Eligibility for the magistracy	Eligibility for public office
Eligibility for the magistracy (Cosmi)	Eligibility for public office
Eligibility for the men's athletic contest	Access to public honors
Eligibility for the office of Treasurer	Eligibility for public office
Eligibility for the priesthood	Eligibility for public office
Eligibility for the supreme military command	Eligibility for public office
Eligibility for the throne	Eligibility for public office
Eligibility for the title of Sage	Access to public honors
Eligibility for the title of poet	Access to public honors
Eligibility for ward enrollment	Right to citizenship
Eligibility for wisdom	Right to valid professional opinion
Exclusive eligibility for kingship	Eligibility for public office
Exclusive sexual access to husband	Right to bodily autonomy
Exclusive use of harbor facilities	Right to own property
Exclusive use of owned property and slaves	Right to retain property
Exemption from agricultural labor	Exemption from manual labor
Exemption from all taxes	Exemption from taxes
Exemption from being considered ridiculous	Protection from public libel
Exemption from compulsory military service	Exemption from manual labor
Exemption from compulsory public financing	Exemption from compulsory public financing
Exemption from compulsory public labor	Exemption from manual labor
Exemption from consecutive mobilization	Exemption from manual labor
Exemption from domestic labor	Exemption from manual labor
Exemption from emotional and physical suffering	Protection from corporal punishment
Exemption from excessive naval costs	Exemption from compulsory public financing
Exemption from executing menial tasks	Exemption from manual labor
Exemption from expensive military service	Exemption from compulsory public financing
Exemption from financial audit	Exemption from legal audit
Exemption from frontline military service	Exemption from manual labor
Exemption from hazardous police duties	Exemption from manual labor
Exemption from judicial labor	Exemption from manual labor
Exemption from legal audit	Exemption from legal audit
Exemption from legal compliance	Protection from legal prosecution
Exemption from legal fines	Protection from legal prosecution
Exemption from legal scrutiny	Exemption from legal audit
Exemption from legal suits	Protection from legal prosecution
Exemption from liability for hyperbole	Right to free speech
Exemption from manual labor	Exemption from manual labor
Exemption from manual musical performance	Exemption from manual labor
Exemption from master's corporal punishment	Protection from corporal punishment
Exemption from menial calling	Exemption from manual labor
Exemption from menial occupations	Exemption from manual labor
Exemption from menial trades	Exemption from manual labor
Exemption from metic tax	Exemption from taxes
Exemption from metic tax or liturgies	Exemption from taxes
Exemption from military cadet service	Exemption from military service
Exemption from military or public service	Exemption from military service
Exemption from military service	Exemption from military service
Exemption from mouse-killing duties	Exemption from manual labor
Exemption from paternal support obligations	Exemption from legal audit
Exemption from personal military service	Exemption from military service
Exemption from physical training	Exemption from manual labor
Exemption from prosecution under expired laws	Protection from legal prosecution
Exemption from providing public meals	Exemption from compulsory public financing
Exemption from public financing	Exemption from compulsory public financing
Exemption from public financing of spectacles	Exemption from compulsory public financing
Exemption from public mockery	Protection from public libel
Exemption from public prosecution	Protection from legal prosecution
Exemption from public sacrifice	Exemption from compulsory public financing
Exemption from public service	Exemption from compulsory public financing
Exemption from public service costs	Exemption from compulsory public financing
Exemption from public service financing	Exemption from compulsory public financing
Exemption from religious initiation	Access to religious rites
Exemption from rendering an account of office	Exemption from legal audit
Exemption from rendering financial accounts	Exemption from legal audit
Exemption from ritual labor	Exemption from manual labor
Exemption from service as Arbitrators	Exemption from compulsory public financing
Exemption from servile duties	Exemption from manual labor
Exemption from social duty due to illness	Exemption from compulsory public financing
Exemption from special levies	Exemption from taxes
Exemption from special taxation	Exemption from taxes
Exemption from special war-taxes	Exemption from taxes
Exemption from state military financing	Exemption from compulsory public financing
Exemption from taxation	Exemption from taxes
Exemption from taxes	Exemption from taxes
Exemption from the hazards of fighting	Exemption from military service
Exemption from the oath in court	Protection from legal prosecution
Exemption from the yoke of necessity	Protection from enslavement
Exemption from trierarchies	Exemption from compulsory public financing
Exemption from war-tax (eisphora)	Exemption from taxes
Fame	Access to public honors
Financial support for military service	Right to remuneration for office
Free distribution of wine	Right to drink wine
Freedom	Protection from enslavement
Freedom from adult oversight	Right to bodily autonomy
Freedom from being sold	Protection from enslavement
Freedom from bondage	Protection from enslavement
Freedom from capital punishment	Protection from capital punishment
Freedom from compulsory marriage	Right to bodily autonomy
Freedom from compulsory political participation	Political power
Freedom from compulsory public financing	Exemption from compulsory public financing
Freedom from compulsory support of ancestors	Right to retain own earnings
Freedom from enslavement	Protection from enslavement
Freedom from household discipline	Right to bodily autonomy
Freedom from lifestyle restrictions	Right to bodily autonomy
Freedom from ownership	Protection from enslavement
Freedom from personal domestic labor	Exemption from manual labor
Freedom from physical compulsion	Protection from corporal punishment
Freedom from pre-trial detention	Right to a legal trial
Freedom from reproductive duties	Right to bodily autonomy
Freedom from royal command	Right to reside in the city
Freedom from state behavioral supervision	Right to bodily autonomy
Freedom from state supervision	Right to bodily autonomy
Freedom from state-enforced moral regulation	Right to bodily autonomy
Freedom of artistic expression	Right to free speech
Freedom of choice in activity	Right to bodily autonomy
Freedom of choice in marriage	Right to bodily autonomy
Freedom of choice in meal timing	Right to bodily autonomy
Freedom of dietary choice	Right to bodily autonomy
Freedom of marital choice	Right to bodily autonomy
Freedom of movement	Right to freedom of movement
Freedom of movement and conversation	Right to freedom of movement
Freedom of movement during war	Right to freedom of movement
Freedom of movement for military command	Right to freedom of movement
Freedom of movement in public	Right to freedom of movement
Freedom of political association	Political power
Freedom of residence within Greece	Right to reside in the city
Freedom of speech	Right to free speech
Freedom of speech and action	Right to free speech
Freedom of speech outside public meals	Right to free speech
Full citizenship rights	Right to citizenship
Full civic rights	Right to citizenship
Full participation in serious dialectical examination	Right to free speech
Full status as an Athenian	Right to citizenship
Generative capacity of semen	Right to bodily autonomy
Guidance in literary interpretation	Right to valid professional opinion
Hereditary political power	Political power
Highest awards and privileges	Access to public honors
Honor from younger generations	Access to public honors
Immunity from adultery prosecution	Protection from legal prosecution
Imperial stipend	Right to remuneration for office
Inclusion among the wise	Access to public honors
Influence over inheritance	Right to dispose of property
Influence over linguistic tradition	Right to valid professional opinion
Influence over others	Political power
Influence over public assemblies	Right to address the assembly
Intensity of physical pleasure	Right to bodily autonomy
Legal autonomy	Political power
Legal protection from the state	Right to a legal trial
Legal redress for physical injury	Right to a legal trial
Legislative finality	Political power
Leisure in speech	Right to free speech
Length of performance time	Right to a legal trial
Linguistic autonomy in word derivation	Right to valid professional opinion
Maintenance in the Prytaneum	Access to public honors
Marital stability within lineage	Right to inherit property
Methodological certainty	Right to professional judgement
Milder government	Political power
Ministry at sacred rites	Eligibility for public office
Obedience to masters	Political power
Official status identification by locality	Right to citizenship
Participation in banquet conversation	Access to public honors
Participation in civic rights	Right to citizenship
Participation in dramatic action	Access to public honors
Participation in political institutions	Political power
Participation in sacred rites	Access to religious rites
Participation in sacred sacrifices	Access to religious rites
Participation in school discussions	Access to the gymnasium
Pay for assembly attendance	Right to remuneration for office
Pay for service in law-courts	Right to remuneration for office
Payment for assembly attendance	Right to remuneration for office
Permission to influence through persuasion	Right to address the assembly
Personal autonomy from non-parental adults	Right to bodily autonomy
Political authority over war and peace	Political power
Political decision-making power	Political power
Political power	Political power
Political power and honor	Political power
Political power over important matters	Political power
Political power over the Amphictyonic Council	Political power
Political power over the community	Political power
Political power over the human herd	Political power
Political power to legislate	Political power
Political rights	Right to citizenship
Political supremacy	Political power
Possession of civic rights	Right to citizenship
Post-mortem soul preservation	Access to religious rites
Power over earthly things	Right to own property
Power to command superiors	Political power
Power to deviate from law	Exemption from legal audit
Power to establish law and order	Political power
Power to exile political leaders	Political power
Power to imprison and execute without trial	Political power
Power to name settlements	Political power
Precedence in estate claims	Right to inherit property
Precedence in public speech	Right to speak first in assembly
Precedence over other magistrates	Political power
Prerogative of religious interpretation	Right to professional judgement
Priority in public speaking	Right to speak first in assembly
Priority in seating precedence	Access to public honors
Priority of dining space	Access to public honors
Protection by personal attendant	Protection from corporal punishment
Protection from abduction in war	Protection from enslavement
Protection from alien tax and patronage	Exemption from taxes
Protection from arbitrary arrest	Right to a legal trial
Protection from arbitrary banishment	Protection from arbitrary banishment
Protection from arbitrary dismissal	Protection from legal prosecution
Protection from arbitrary ejection	Right to reside in the city
Protection from arbitrary enslavement	Protection from enslavement
Protection from arbitrary execution	Protection from capital punishment
Protection from arbitrary imprisonment	Protection from corporal punishment
Protection from arbitrary law enforcement	Right to a legal trial
Protection from arbitrary mass execution	Protection from capital punishment
Protection from audit for gifts	Exemption from legal audit
Protection from banishment or ostracism	Protection from arbitrary banishment
Protection from being hired for prostitution	Protection from enslavement
Protection from being sold	Protection from enslavement
Protection from biased legal pleading	Right to a legal trial
Protection from blackmailers	Protection from legal prosecution
Protection from capital punishment	Protection from capital punishment
Protection from capture and enslavement	Protection from enslavement
Protection from capture in shrines	Access to religious rites
Protection from compulsory educational fees	Exemption from compulsory public financing
Protection from compulsory military service	Exemption from compulsory public financing
Protection from compulsory public service	Exemption from compulsory public financing
Protection from condemnation in absentia	Right to a legal trial
Protection from conviction	Protection from legal prosecution
Protection from conviction based on relational testimony	Right to a legal trial
Protection from corporal and sexual outrage	Protection from corporal punishment
Protection from corporal confinement	Protection from corporal punishment
Protection from corporal punishment	Protection from corporal punishment
Protection from corporal punishment during legal proceedings	Protection from corporal punishment
Protection from corporal punishment during trial	Protection from corporal punishment
Protection from corporal restraint	Protection from corporal punishment
Protection from corporal torture	Protection from corporal punishment
Protection from corruption by foreigners	Right to citizenship
Protection from creditor harassment	Right to retain property
Protection from criminal punishment	Right to a legal trial
Protection from debt slavery	Protection from enslavement
Protection from degrading labor	Exemption from manual labor
Protection from degrading treatment	Protection from corporal punishment
Protection from disaster or insult	Protection from public libel
Protection from disfranchisement	Right to citizenship
Protection from disproportionate taxation	Exemption from taxes
Protection from divine punishment for perjury	Access to religious rites
Protection from early marriage	Right to bodily autonomy
